título,descripción,edad,inscripción,periodicidad,día_días,horario,fecha,lugar_nombre,lugar_dirección,precio,recomendación,url_ampliar_info,url_actividad
Taller de ajedrez avanzado (infantil-juvenil) Biblioteca María Lejárraga,"Taller avanzado para el perfeccionamiento de la práctica del ajedrez, deporte de reconocidos beneficios a nivel cognitivo e intelectual que mejora la memoria, la concentración y permite ejercitar ambos hemisferios cerebrales.",Dirigidos a usuarios de 6 a 17 años,Para participar es impresindible realizar inscripción previa en este enlace.,semanal,miércoles,Las sesiones de este taller se celebrarán los miércoles de 18:30 a 19:30 horas,Del miércoles 19 de marzo de 2025 al miércoles 4 de junio de 2025,Biblioteca Pública Municipal María Lejárraga (Hortaleza),"CALLE PRINCESA DE EBOLI, 29 MADRID",Gratuito,Recomendado para niñas y niños,https://www.madrid.es/portales/munimadrid/es/Inicio/Cultura-ocio-y-deporte/Taller-de-ajedrez-infantil-juvenil-/?vgnextfmt=default&vgnextoid=b9624861ee4e6810VgnVCM1000001d4a900aRCRD&vgnextchannel=7911f073808fe410VgnVCM2000000c205a0aRCRD,https://www.madrid.es/portales/munimadrid/es/Inicio/Cultura-ocio-y-deporte/Taller-de-ajedrez-avanzado-infantil-juvenil-Biblioteca-Maria-Lejarraga/?vgnextfmt=default&vgnextoid=991163008c7c5910VgnVCM1000001d4a900aRCRD&vgnextchannel=7911f073808fe410VgnVCM2000000c205a0aRCRD
Manualidades,"Taller de manualidades ideado, coordinado y ejecutado por mujeres del barrio.",Dirigido a niñas y niños de 6 a 12 años,El proceso de inscripción finaliza el 23/06/2025,No especificada,martes,de 18 a 19:30 horas,El proceso de inscripción finaliza el 23/06/2025,Biblioteca Pública Municipal Gabriel García Márquez (Usera),"PLAZA PUEBLO, 2 (CENTRO CULTURAL ORCASUR) 28041 MADRID",Gratuito,Recomendado para niñas y niños,No disponible,https://www.madrid.es/portales/munimadrid/es/Inicio/Cultura-ocio-y-deporte/Manualidades/?vgnextfmt=default&vgnextoid=3da790ec79b45910VgnVCM2000001f4a900aRCRD&vgnextchannel=7911f073808fe410VgnVCM2000000c205a0aRCRD
Talleres de Price (De 7 a 9 años),¡Diviértete aprendiendo mientras descubres todo lo que eres capaz de hacer!,Edad: De 7 a 9 años,No especificada,No especificada,No especificado,Horario: De 10 a 12 horas,Del sábado 29 de marzo de 2025 al sábado 14 de junio de 2025,Teatro Circo Price,"RONDA ATOCHA, 35 28012 MADRID",No especificado,Recomendado para niñas y niños,No disponible,https://www.madrid.es/portales/munimadrid/es/Inicio/Cultura-ocio-y-deporte/Talleres-de-Price-De-7-a-9-anos-/?vgnextfmt=default&vgnextoid=f981045e3fd15910VgnVCM1000001d4a900aRCRD&vgnextchannel=7911f073808fe410VgnVCM2000000c205a0aRCRD
Talleres del Price (5 y 6 años),¡Diviértete aprendiendo mientras descubres todo lo que eres capaz de hacer!,Edad: 5 y 6 años,No especificada,No especificada,No especificado,No especificado,Del sábado 29 de marzo de 2025 al sábado 14 de junio de 2025,Teatro Circo Price,"RONDA ATOCHA, 35 28012 MADRID","Abono trimestral (10 sesiones): 140 euros
Abono 5 sesiones: 90 euros
 
Toda la información en la página del teatro Circo Price. Abono trimestral (10 sesiones): 140 euros. Abono 5 sesiones: 90 euros",No especificado,No disponible,https://www.madrid.es/portales/munimadrid/es/Inicio/Cultura-ocio-y-deporte/Talleres-del-Price-5-y-6-anos-/?vgnextfmt=default&vgnextoid=12a1045e3fd15910VgnVCM1000001d4a900aRCRD&vgnextchannel=7911f073808fe410VgnVCM2000000c205a0aRCRD
LUDOTECAS,"Sábados de abril y laborables no lectivos de Semana Santa: días 5, 11, 12, 14, 15, 16, 19, 21 y 26 de abril de 10:30 a 13:30 horas.",para niños y niñas con edad comprendidas entre 4 y 10 años,"Actividad gratuita y de carácter abierto, sin inscripción previa, para niños y niñas con edad comprendidas entre 4 y 10 años.. Actividad gratuita y de carácter abierto, sin inscripción previa, para niños y niñas con edad comprendidas entre 4 y 10 años.",No especificada,sábado,21 y 26 de abril de 10:30 a 13:30 horas,Del sábado 5 de abril de 2025 al sábado 26 de abril de 2025,Centro Sociocultural Valverde (Fuencarral - El Pardo),"PLAZA ISLAS AZORES, 1 MADRID",Gratuito,Recomendado para niñas y niños,https://www.madrid.es/portales/munimadrid/es/Inicio/Cultura-ocio-y-deporte/Actividades-Centro-Sociocultural-Valverde-Fuencarral-El-Pardo-Abril-2025/?vgnextfmt=default&vgnextoid=1be184114f09c810VgnVCM2000001f4a900aRCRD&vgnextchannel=7911f073808fe410VgnVCM2000000c205a0aRCRD,https://www.madrid.es/portales/munimadrid/es/Inicio/Cultura-ocio-y-deporte/LUDOTECAS/?vgnextfmt=default&vgnextoid=4048227bcdbd5910VgnVCM2000001f4a900aRCRD&vgnextchannel=7911f073808fe410VgnVCM2000000c205a0aRCRD
TALLERES INFANTILES,Sábados 5 y 19. MONSTRUOS DEL RIO: Para menores de 6 a 8 años. Máximo 20 plazas. De 11 a 12 h.,Para menores de 6 a 8 años,No especificada,No especificada,"sábado, domingo",No especificado,Del sábado 5 de abril de 2025 al domingo 27 de abril de 2025,Centro de Interpretación de la Naturaleza Montecarmelo (Fuencarral - El Pardo),"Carretera M-607 Km 13 L-10, null MADRID",Gratuito,Recomendado para niñas y niños,https://www.madrid.es/portales/munimadrid/es/Inicio/Cultura-ocio-y-deporte/Actividades-Centro-de-Interpretacion-de-la-Naturaleza-Montecarmelo-Abril-2025/?vgnextfmt=default&vgnextoid=97fbb1980a322610VgnVCM2000001f4a900aRCRD&vgnextchannel=7911f073808fe410VgnVCM2000000c205a0aRCRD,https://www.madrid.es/portales/munimadrid/es/Inicio/Cultura-ocio-y-deporte/TALLERES-INFANTILES/?vgnextfmt=default&vgnextoid=4ae0b2de9aa7e810VgnVCM1000001d4a900aRCRD&vgnextchannel=7911f073808fe410VgnVCM2000000c205a0aRCRD
Taller infantil. Reciclo y utilizo,"Reciclado creativo para pequeños ecologistas: camino hacia la sostenibilidad. Los sábados 5, 12 y 26 de abril, niños y niñas de 6 a 12 años descubrirán los tesoros ocultos en los materiales reciclados. A través de la creatividad y la diversión, aprenderán a proteger nuestro planeta y desarrollarán habilidades para toda la vida. El reciclado no solo beneficia al medio ambiente, sino que también les enseña la importancia del cuidado y la responsabilidad, empoderándolos como futuros guardianes de nuestrohermoso planeta. Fomentaremos la toma de conciencia ambiental, el amor por la naturaleza, enseñar la importancia del reciclaje, la reutilización de materiales y el desarrollo de habilidades creativas y destrezas manuales.",niños y niñas de 6 a 12 años descubrirán los tesoros ocultos en los materiales reciclados,"INSCRIPCIONES: en el centro cultural el primer día de taller, por orden de llegada.",semanal,sábado,de 10:30 a 12 horas,Del sábado 5 de abril de 2025 al sábado 26 de abril de 2025,Centro Cultural Carril del Conde (Hortaleza),"CALLE CARRIL DEL CONDE, 57 MADRID",Gratuito,Recomendado para niñas y niños,https://www.madrid.es/portales/munimadrid/es/Inicio/Cultura-ocio-y-deporte/Actividades-en-el-Centro-Cultural-Carril-del-Conde/?vgnextfmt=default&vgnextoid=4dc76ed8d8a75610VgnVCM2000001f4a900aRCRD&vgnextchannel=7911f073808fe410VgnVCM2000000c205a0aRCRD,https://www.madrid.es/portales/munimadrid/es/Inicio/Cultura-ocio-y-deporte/Taller-infantil-Reciclo-y-utilizo/?vgnextfmt=default&vgnextoid=ea08c4af1b0f5910VgnVCM2000001f4a900aRCRD&vgnextchannel=7911f073808fe410VgnVCM2000000c205a0aRCRD
LUDOTECAS,Sábados de abril y días laborales no lectivos de Semana Santa:,para niños y niñas con edades comprendidas entre 4 y 10 años,"Actividad gratuita y de carácter abierto, sin inscripción previa, para niños y niñas con edades comprendidas entre 4 y 10 años.. Actividad gratuita y de carácter abierto, sin inscripción previa, para niños y niñas con edades comprendidas entre 4 y 10 años.",No especificada,sábado,No especificado,Del sábado 5 de abril de 2025 al sábado 26 de abril de 2025,Centro Sociocultural Alfonso XII (Fuencarral - El Pardo),"CALLE MIRA EL RIO, 4 MADRID",Gratuito,Recomendado para niñas y niños,https://www.madrid.es/portales/munimadrid/es/Inicio/Cultura-ocio-y-deporte/Actividades-Centro-Sociocultural-Alfonso-XII-Fuencarral-El-Pardo-Abril-2025/?vgnextfmt=default&vgnextoid=f4c4bf1731221610VgnVCM2000001f4a900aRCRD&vgnextchannel=7911f073808fe410VgnVCM2000000c205a0aRCRD,https://www.madrid.es/portales/munimadrid/es/Inicio/Cultura-ocio-y-deporte/LUDOTECAS/?vgnextfmt=default&vgnextoid=6ed8bf0a69363910VgnVCM2000001f4a900aRCRD&vgnextchannel=7911f073808fe410VgnVCM2000000c205a0aRCRD
Deportes populares y tradicionales para familias,Para todos los públicos. Sin inscripción previa. + info: 691077760.,No especificada,Sin inscripción previa.. Para todos los públicos. Sin inscripción previa. + info: 691077760.,No especificada,sábado,No especificado,Del sábado 5 de abril de 2025 al sábado 26 de abril de 2025,Centro Cultural Galileo (Chamberí),"CALLE GALILEO, 39 MADRID",Gratuito,Recomendado para niñas y niños,https://www.madrid.es/portales/munimadrid/es/Inicio/Cultura-ocio-y-deporte/Programacion-Cultural-Chamberi/?vgnextfmt=default&vgnextoid=5ea6daba65bc4910VgnVCM1000001d4a900aRCRD&vgnextchannel=7911f073808fe410VgnVCM2000000c205a0aRCRD,https://www.madrid.es/portales/munimadrid/es/Inicio/Cultura-ocio-y-deporte/Deportes-populares-y-tradicionales-para-familias/?vgnextfmt=default&vgnextoid=97b8e7bd62dc5910VgnVCM2000001f4a900aRCRD&vgnextchannel=7911f073808fe410VgnVCM2000000c205a0aRCRD
TALLERES FAMILIARES,Para familias con menores de diferentes edades. Máximo 20 plazas.,A partir de 6 años,No especificada,No especificada,"viernes, sábado, domingo",No especificado,Del domingo 6 de abril de 2025 al sábado 26 de abril de 2025,Centro de Interpretación de la Naturaleza Montecarmelo (Fuencarral - El Pardo),"Carretera M-607 Km 13 L-10, null MADRID",Gratuito,Recomendado para niñas y niños,https://www.madrid.es/portales/munimadrid/es/Inicio/Cultura-ocio-y-deporte/Actividades-Centro-de-Interpretacion-de-la-Naturaleza-Montecarmelo-Abril-2025/?vgnextfmt=default&vgnextoid=97fbb1980a322610VgnVCM2000001f4a900aRCRD&vgnextchannel=7911f073808fe410VgnVCM2000000c205a0aRCRD,https://www.madrid.es/portales/munimadrid/es/Inicio/Cultura-ocio-y-deporte/TALLERES-FAMILIARES/?vgnextfmt=default&vgnextoid=ac22b2de9aa7e810VgnVCM1000001d4a900aRCRD&vgnextchannel=7911f073808fe410VgnVCM2000000c205a0aRCRD
HOP!,Los Absurdos Teatro nos traen un paseo teatralizado por la historia del Circo Price.,sus anécdotas y su importancia como centro cultural del Madrid de los últimos 150 años,No especificada,No especificada,No especificado,Horario: comienzo de la visita a las 11 horas,Sin fecha,Teatro Circo Price,"RONDA ATOCHA, 35 28012 MADRID",No especificado,Recomendado para niñas y niños,No disponible,https://www.madrid.es/portales/munimadrid/es/Inicio/Cultura-ocio-y-deporte/HOP-/?vgnextfmt=default&vgnextoid=95698cdcd77d5910VgnVCM1000001d4a900aRCRD&vgnextchannel=7911f073808fe410VgnVCM2000000c205a0aRCRD
"Fiesta de pijamas para peluches, muñecas y muñecos. ¡Fin de semana en la Biblioteca!","¿Quieres saber qué haría tu peluche o muñeco/a favorito/a en la Biblioteca, cuando cierre al público, todo el fin de semana?",Para niñas y niños hasta 14 años,Inscripciones en el mostrador de la biblioteca,No especificada,No especificado,No especificado,Del lunes 21 de abril de 2025 al viernes 25 de abril de 2025,Biblioteca Pública Municipal Francisco Ayala (Vicálvaro),"BULEVAR INDALECIO PRIETO, 21 28032 MADRID",Gratuito,Recomendado para niñas y niños,No disponible,https://www.madrid.es/portales/munimadrid/es/Inicio/Cultura-ocio-y-deporte/Fiesta-de-pijamas-para-peluches-munecas-y-munecos-Fin-de-semana-en-la-Biblioteca-/?vgnextfmt=default&vgnextoid=cac159ad2a006910VgnVCM2000001f4a900aRCRD&vgnextchannel=7911f073808fe410VgnVCM2000000c205a0aRCRD
Campamentos urbanos de verano 2025. Distrito Arganzuela,"Se realizarán actividades de ocio lúdico-educativas, incluyendo los servicios de desayuno y comida. La actividad será gratuita y se ofertarán 240 plazas durante el mes de julio y 150 plazas durante los días de junio y 180 plazas por centro durante el mes de agosto y septiembre. En total 1.170 plazas durante todo el verano.",Niños y niñas de 4 años a 12 años,No especificada,No especificada,domingo,30 a 9 horas: horario de acogida,Sin fecha,Colegio Público Plácido Domingo,"CALLE TEJO, 5 28045 MADRID",Gratuito,Recomendado para niñas y niños,No disponible,https://www.madrid.es/portales/munimadrid/es/Inicio/Cultura-ocio-y-deporte/Campamentos-urbanos-de-verano-2025-Distrito-Arganzuela/?vgnextfmt=default&vgnextoid=0f5297c7fe556910VgnVCM2000001f4a900aRCRD&vgnextchannel=7911f073808fe410VgnVCM2000000c205a0aRCRD
Entrega de premios,En este acto haremos la entrega de premios a las ganadoras y ganadores de los concursos:,No especificada,No especificada,No especificada,No especificado,Martes 22 de abril de 2025 a las 18 horas,Martes 22 de abril de 2025 a las 18 horas,Biblioteca Pública Municipal San Blas (San Blas-Canillejas),"CALLE SAN ROMAN DEL VALLE, 8 (CENTRO CULTURAL ANTONIO MACHADO) 28037 MADRID",Gratuito,Recomendado para niñas y niños,No disponible,https://www.madrid.es/portales/munimadrid/es/Inicio/Cultura-ocio-y-deporte/Entrega-de-premios/?vgnextfmt=default&vgnextoid=07bb57fd86c55910VgnVCM2000001f4a900aRCRD&vgnextchannel=7911f073808fe410VgnVCM2000000c205a0aRCRD
Taller Día del Libro (Cuentos y manualidad),"Como el día 23 de abril es el Día de Libro, vamos a celebrarlo juntos el día 22.",Para niñas y niños de 5 a 8 años,El proceso de inscripción finaliza el 22/04/2025,No especificada,No especificado,Martes 22 de abril de 2025 a las 18 horas,El proceso de inscripción finaliza el 22/04/2025,Biblioteca Pública Municipal Canillejas (San Blas-Canillejas),"CALLE BOLTAÑA, 23 (EN CENTRO CULTURAL BUERO VALLEJO) 28022 MADRID",Gratuito,Recomendado para niñas y niños,No disponible,https://www.madrid.es/portales/munimadrid/es/Inicio/Cultura-ocio-y-deporte/Taller-Dia-del-Libro-Cuentos-y-manualidad-/?vgnextfmt=default&vgnextoid=e8a4d5eb73516910VgnVCM2000001f4a900aRCRD&vgnextchannel=7911f073808fe410VgnVCM2000000c205a0aRCRD
Presentación y Recital de Poesía. Mapa de corazonadas,"Recital de poesía y presentación del libro Mapa de corazonadas, de Carlos Llorente Toledo.",No especificada,No especificada,No especificada,No especificado,Martes 22 de abril de 2025 a las 19 horas,Martes 22 de abril de 2025 a las 19 horas,Centro Cultural Puerta de Toledo (Centro),"AVENIDA GRAN VIA DE SAN FRANCISCO, 2 MADRID",Gratuito,Recomendado para niñas y niños,https://www.madrid.es/portales/munimadrid/es/Inicio/Cultura-ocio-y-deporte/Actividades-en-el-Centro-Cultural-Puerta-de-Toledo/?vgnextfmt=default&vgnextoid=8d42fd00f7902910VgnVCM2000001f4a900aRCRD&vgnextchannel=7911f073808fe410VgnVCM2000000c205a0aRCRD,https://www.madrid.es/portales/munimadrid/es/Inicio/Cultura-ocio-y-deporte/Presentacion-y-Recital-de-Poesia-Mapa-de-corazonadas/?vgnextfmt=default&vgnextoid=c8729125a23a5910VgnVCM1000001d4a900aRCRD&vgnextchannel=7911f073808fe410VgnVCM2000000c205a0aRCRD
"La Hora del Cuento : ""El lobo que se cayó de un libro"" y ""El Oso que amaba los libros""","La hora del cuento es una actividad que tiene lugar en nuestra Biblioteca un martes de cada mes, donde los más peques de la casa, podrán participar de un cuentacuentos que generalmente se acompañara de actividades.",A partir de 3 años,No especificada,No especificada,martes,Martes 22 de abril de 2025 a las 17:30 horas,Martes 22 de abril de 2025 a las 17:30 horas,Biblioteca Pública Municipal Manuel Vázquez Montalbán (Tetuán),"CALLE FRANCOS RODRIGUEZ, 67 MADRID",Gratuito,Recomendado para niñas y niños,https://www.madrid.es/portales/munimadrid/es/Inicio/Cultura-ocio-y-deporte/Cuentacuentos-del-21-al-27-de-abril/?vgnextfmt=default&vgnextoid=e08d8f8c825d9810VgnVCM2000001f4a900aRCRD&vgnextchannel=7911f073808fe410VgnVCM2000000c205a0aRCRD,https://www.madrid.es/portales/munimadrid/es/Inicio/Cultura-ocio-y-deporte/La-Hora-del-Cuento-El-lobo-que-se-cayo-de-un-libro-y-El-Oso-que-amaba-los-libros-/?vgnextfmt=default&vgnextoid=9c80a1b80d426910VgnVCM1000001d4a900aRCRD&vgnextchannel=7911f073808fe410VgnVCM2000000c205a0aRCRD
'El secreto de los cuentos',"Duendes, tesoros, aventuras, misterios... Las bibliotecas están llenas de historias que cuenteros y cuenteras nos acercan a través de su creatividad y su magia.",Este cuento está pensado para niñas y niños a partir de 3 años,Para asistir es necesario realizar inscripción previa a través de este enlace.,No especificada,No especificado,Martes 22 de abril de 2025 a las 18 horas,Martes 22 de abril de 2025 a las 18 horas,Biblioteca Pública Municipal Francisco Ibáñez (Chamartín),"CALLE MANTUANO, 51 MADRID",Gratuito,Recomendado para niñas y niños,https://www.madrid.es/portales/munimadrid/es/Inicio/Cultura-ocio-y-deporte/Cuentacuentos-del-21-al-27-de-abril/?vgnextfmt=default&vgnextoid=e08d8f8c825d9810VgnVCM2000001f4a900aRCRD&vgnextchannel=7911f073808fe410VgnVCM2000000c205a0aRCRD,https://www.madrid.es/portales/munimadrid/es/Inicio/Cultura-ocio-y-deporte/-El-secreto-de-los-cuentos-/?vgnextfmt=default&vgnextoid=db686ab5d26f5910VgnVCM2000001f4a900aRCRD&vgnextchannel=7911f073808fe410VgnVCM2000000c205a0aRCRD
'La máscara del león',Ven a la biblioteca a escuchar su historia y la de otros encantadores personajes que salen de paseo cuando llega la hora del cuento.,Para niños y niñas a partir de 4 añosInscripción a través de formulario,Para niños y niñas a partir de 4 añosInscripción a través de formulario.. Inscripción a través de formulario. (Hasta el 21 de abril),No especificada,No especificado,Martes 22 de abril de 2025 a las 18 horas,Martes 22 de abril de 2025 a las 18 horas,Biblioteca Pública Municipal Ana María Matute (Carabanchel),"CALLE ISAAC ALBENIZ, 1 MADRID",Gratuito,Recomendado para niñas y niños,https://www.madrid.es/portales/munimadrid/es/Inicio/Cultura-ocio-y-deporte/Cuentacuentos-del-21-al-27-de-abril/?vgnextfmt=default&vgnextoid=e08d8f8c825d9810VgnVCM2000001f4a900aRCRD&vgnextchannel=7911f073808fe410VgnVCM2000000c205a0aRCRD,https://www.madrid.es/portales/munimadrid/es/Inicio/Cultura-ocio-y-deporte/-La-mascara-del-leon-/?vgnextfmt=default&vgnextoid=fcefdbca8c516910VgnVCM1000001d4a900aRCRD&vgnextchannel=7911f073808fe410VgnVCM2000000c205a0aRCRD
Actividad familiar: JUEGOS DE ROL,"El día 23 de abril celebramos el día del Libro con unos emocionantes JUEGOS DE ROL, destinados a niñas y niños de 6 a 15 años, y de 16 años en adelante",destinados a niñas y niños de 6 a 15 años,Inscríbete en este enlace,No especificada,No especificado,Miércoles 23 de abril de 2025 a las 17 horas,Miércoles 23 de abril de 2025 a las 17 horas,Biblioteca Pública Municipal Gerardo Diego (Villa de Vallecas),"CALLE MONTE AYA, 12 28031 MADRID",Gratuito,Recomendado para niñas y niños,No disponible,https://www.madrid.es/portales/munimadrid/es/Inicio/Cultura-ocio-y-deporte/Actividad-familiar-JUEGOS-DE-ROL/?vgnextfmt=default&vgnextoid=f8913e06256f5910VgnVCM1000001d4a900aRCRD&vgnextchannel=7911f073808fe410VgnVCM2000000c205a0aRCRD
Presentación del libro La bamda y el cuadro siberiano,De María Jesús Rodriguez Costa.,A partir de 6 años,No especificada,No especificada,No especificado,Miércoles 23 de abril de 2025 a las 17:30 horas,Miércoles 23 de abril de 2025 a las 17:30 horas,Centro Cultural Huerta de la Salud (Hortaleza),"CALLE MAR DE LAS ANTILLAS, 8 MADRID",Gratuito,Recomendado para niñas y niños,https://www.madrid.es/portales/munimadrid/es/Inicio/Cultura-ocio-y-deporte/Actividades-en-el-Centro-Cultural-Huerta-de-la-Salud/?vgnextfmt=default&vgnextoid=0d3923f64f68d610VgnVCM1000001d4a900aRCRD&vgnextchannel=7911f073808fe410VgnVCM2000000c205a0aRCRD,https://www.madrid.es/portales/munimadrid/es/Inicio/Cultura-ocio-y-deporte/Presentacion-del-libro-La-bamda-y-el-cuadro-siberiano/?vgnextfmt=default&vgnextoid=ef9c901b5b516910VgnVCM2000001f4a900aRCRD&vgnextchannel=7911f073808fe410VgnVCM2000000c205a0aRCRD
'¿Tu mono quiere un plátano?',Sin descripción,Paula Sánchez Arévalo fue bailarina con el Nederland DansTheater de los Países Bajos durante 17 años,No especificada,No especificada,No especificado,Miércoles 23 de abril de 2025 a las 18 horas,Miércoles 23 de abril de 2025 a las 18 horas,Biblioteca Pública Municipal Eugenio Trías. Casa de Fieras de El Retiro (Retiro),"PASEO FERNÁN NÚÑEZ, 24 MADRID",Gratuito,Recomendado para niñas y niños,https://www.madrid.es/portales/munimadrid/es/Inicio/Cultura-ocio-y-deporte/Cuentacuentos-del-21-al-27-de-abril/?vgnextfmt=default&vgnextoid=e08d8f8c825d9810VgnVCM2000001f4a900aRCRD&vgnextchannel=7911f073808fe410VgnVCM2000000c205a0aRCRD,https://www.madrid.es/portales/munimadrid/es/Inicio/Cultura-ocio-y-deporte/-Tu-mono-quiere-un-platano-/?vgnextfmt=default&vgnextoid=d795dbca8c516910VgnVCM1000001d4a900aRCRD&vgnextchannel=7911f073808fe410VgnVCM2000000c205a0aRCRD
Taller especial 'Día del Libro',"El miércoles 23 de abril os invitamos a nuestro TALLER ESPECIAL DÍA DEL LIBRO, donde podreis disfrutar del cuento ""Los fantásticos libros voladores del Sr. Morris Lessmore"" y además aprender a hacer tus propias agendas y marcapáginas.",A partir de 4 años,No especificada,No especificada,miércoles,Miércoles 23 de abril de 2025 a las 17 horas,Miércoles 23 de abril de 2025 a las 17 horas,Biblioteca Pública Municipal Manuel Vázquez Montalbán (Tetuán),"CALLE FRANCOS RODRIGUEZ, 67 28039 MADRID",Gratuito,Recomendado para niñas y niños,No disponible,https://www.madrid.es/portales/munimadrid/es/Inicio/Cultura-ocio-y-deporte/Taller-especial-Dia-del-Libro-/?vgnextfmt=default&vgnextoid=ec37cf89a0436910VgnVCM1000001d4a900aRCRD&vgnextchannel=7911f073808fe410VgnVCM2000000c205a0aRCRD
Lectura pública del Quijote para niños y mayores,Horarios: de 11 a 12 horas y de 16:30 a 18:30 horas,No especificada,No especificada,No especificada,No especificado,Horarios: de 11 a 12 horas y de 16:30 a 18:30 horas,Miércoles 23 de abril de 2025,Sin lugar,Sin dirección,Gratuito,Recomendado para niñas y niños,https://www.madrid.es/portales/munimadrid/es/Inicio/Cultura-ocio-y-deporte/IV-Feria-del-libro-de-Arganzuela-2025/?vgnextfmt=default&vgnextoid=8ccf469921be5910VgnVCM2000001f4a900aRCRD&vgnextchannel=7911f073808fe410VgnVCM2000000c205a0aRCRD,https://www.madrid.es/portales/munimadrid/es/Inicio/Cultura-ocio-y-deporte/Lectura-publica-del-Quijote-para-ninos-y-mayores/?vgnextfmt=default&vgnextoid=a3c4aa4735436910VgnVCM1000001d4a900aRCRD&vgnextchannel=7911f073808fe410VgnVCM2000000c205a0aRCRD
Obra literaria infantil: La tierra de Jauja,"Honzigera y Panarizo, dos ladrones hambrientos, deciden asaltar a Mendrugo, un labrador que lleva comida a su esposa en la cárcel. Con astucia, engañan a Mendrugo hablándole sobre la fantástica Tierra de Jauja, un lugar utópico donde la comida abunda y está prohibido trabajar. Aprovechando la distracción de Mendrugo, Honzigera se zambulle en la cazuela de buñuelos, devorando rápidamente todo el manjar. Mendrugo, desconcertado, comprende que esa tierra es sólo una ilusión y que la felicidad no proviene de promesas ficticias. Quedando solo, y sin nada, se culpa a sí mismo por haber creído en fantasías, aprendiendo de la lección.",No especificada,No especificada,No especificada,No especificado,Miércoles 23 de abril de 2025 a las 12:30 horas,Miércoles 23 de abril de 2025 a las 12:30 horas,Sin lugar,Sin dirección,Gratuito,Recomendado para niñas y niños,https://www.madrid.es/portales/munimadrid/es/Inicio/Cultura-ocio-y-deporte/IV-Feria-del-libro-de-Arganzuela-2025/?vgnextfmt=default&vgnextoid=8ccf469921be5910VgnVCM2000001f4a900aRCRD&vgnextchannel=7911f073808fe410VgnVCM2000000c205a0aRCRD,https://www.madrid.es/portales/munimadrid/es/Inicio/Cultura-ocio-y-deporte/Obra-literaria-infantil-La-tierra-de-Jauja/?vgnextfmt=default&vgnextoid=00d4aa4735436910VgnVCM1000001d4a900aRCRD&vgnextchannel=7911f073808fe410VgnVCM2000000c205a0aRCRD
