título,descripción,edad,inscripción,periodicidad,día_días,horario,fecha,lugar_nombre,lugar_dirección,precio,recomendación,url_ampliar_info,url_imagen,url_actividad
Orcobblu,Edad recomendada: +5 años,No especificada,No especificada,No especificada,domingo,a las 12 horas,Domingo 11 de mayo de 2025,Centro Cultural Meseta de Orcasitas (Usera),"PLAZA ASOCIACION, 1 MADRID",Gratuito,Recomendado para niñas y niños,https://www.madrid.es/portales/munimadrid/es/Inicio/Cultura-ocio-y-deporte/Actividades-del-Centro-Cultural-Meseta-de-Orcasitas/?vgnextfmt=default&vgnextoid=82fe2d24e6f61910VgnVCM2000001f4a900aRCRD&vgnextchannel=7911f073808fe410VgnVCM2000000c205a0aRCRD,https://www.madrid.es/UnidadWeb/UGBBDD/Actividades/Distritos/Usera/ProgramacionCulturalUsera/ficheros/1205_Orcobblu.png,https://www.madrid.es/portales/munimadrid/es/Inicio/Cultura-ocio-y-deporte/Orcobblu/?vgnextfmt=default&vgnextoid=d6ac03a1c2d56910VgnVCM1000001d4a900aRCRD&vgnextchannel=7911f073808fe410VgnVCM2000000c205a0aRCRD
Crea tus propios imanes para celebrar el Día Mundial de las aves Migratorias,Horario:﻿ de 10:30 a 12 horas.,a partir de 4 años,No especificada,No especificada,domingo,a las 10:30 horas,Domingo 11 de mayo de 2025,Centro de Educación Ambiental y Cultural Maris Stella (Usera),"CALLE DOCTOR TOLOSA LATOUR, 16 MADRID",Gratuito,Recomendado para niñas y niños,https://www.madrid.es/portales/munimadrid/es/Inicio/Cultura-ocio-y-deporte/Actividades-en-el-Centro-de-Educacion-Ambiental-y-Cultural-Maris-Stella/?vgnextfmt=default&vgnextoid=4e25ce5179e61910VgnVCM1000001d4a900aRCRD&vgnextchannel=7911f073808fe410VgnVCM2000000c205a0aRCRD,https://www.madrid.es/UnidadWeb/UGBBDD/Actividades/Distritos/Usera/ProgramacionCulturalUsera/MarisStella/ficheros/0512_Crea_Imanes.png,https://www.madrid.es/portales/munimadrid/es/Inicio/Cultura-ocio-y-deporte/Crea-tus-propios-imanes-para-celebrar-el-Dia-Mundial-de-las-aves-Migratorias/?vgnextfmt=default&vgnextoid=2473cbdaa1266910VgnVCM1000001d4a900aRCRD&vgnextchannel=7911f073808fe410VgnVCM2000000c205a0aRCRD
Leo y la música,Los domingos del Pozo.,No especificada,No especificada,No especificada,domingo,a las 12 horas,Domingo 11 de mayo de 2025,Centro Cultural El Pozo del tío Raimundo (Puente de Vallecas),"AVENIDA GLORIETAS, 19 MADRID",Gratuito,Recomendado para niñas y niños,https://www.madrid.es/portales/munimadrid/es/Inicio/Cultura-ocio-y-deporte/Actividades-en-el-Centro-Cultural-El-Pozo-del-Tio-Raimundo/?vgnextfmt=default&vgnextoid=5c0f16c17a87f610VgnVCM2000001f4a900aRCRD&vgnextchannel=7911f073808fe410VgnVCM2000000c205a0aRCRD,https://www.madrid.es/UnidadWeb/UGBBDD/Actividades/Distritos/PuenteVallecas/Actividades/ficheros/1905VF.jpg,https://www.madrid.es/portales/munimadrid/es/Inicio/Cultura-ocio-y-deporte/Leo-y-la-musica/?vgnextfmt=default&vgnextoid=84fb1dc120866910VgnVCM1000001d4a900aRCRD&vgnextchannel=7911f073808fe410VgnVCM2000000c205a0aRCRD
Cuentos con amor por un mundo mejor,"Duendes, tesoros, aventuras, misterios... Las bibliotecas están llenas de historias que cuenteros y cuenteras nos acercan a través de su creatividad y su magia.",a partir de 3 años,No especificada,No especificada,lunes,a las 12 horas,Domingo 11 de mayo de 2025,Biblioteca Pública Municipal Ángel González (Latina),"CALLE GRANJA DE TORREHERMOSA, 1 MADRID",Gratuito,Recomendado para niñas y niños,https://www.madrid.es/portales/munimadrid/es/Inicio/Cultura-ocio-y-deporte/Cuentacuentos-del-5-al-11-de-mayo/?vgnextfmt=default&vgnextoid=6caba32d985f5910VgnVCM1000001d4a900aRCRD&vgnextchannel=7911f073808fe410VgnVCM2000000c205a0aRCRD,https://www.madrid.es/UnidadesDescentralizadas/Bibliotecas/BibliotecasPublicas/Actividades/Actividades_Infantiles_Juveniles/Cuentacuentos/ficheros/250425_CuentosLinterna_260x260.jpg,https://www.madrid.es/portales/munimadrid/es/Inicio/Cultura-ocio-y-deporte/Cuentos-con-amor-por-un-mundo-mejor/?vgnextfmt=default&vgnextoid=0d40468e9b336910VgnVCM1000001d4a900aRCRD&vgnextchannel=7911f073808fe410VgnVCM2000000c205a0aRCRD
El dragón Nabú,,Recomendado para mayores de 4 años,No especificada,No especificada,domingo,a las 12 horas,Domingo 11 de mayo de 2025,Auditorio Joaquín Rosado (Moncloa-Aravaca),"CALLE SANTA POLA, 22 28008 MADRID",Gratuito,Recomendado para niñas y niños,No disponible,https://www.madrid.es/UnidadesDescentralizadas/DistritoMoncloaAravaca/Actividades/2025/05Mayo2025/Carteleria/ANIMATHOR.jpg,https://www.madrid.es/portales/munimadrid/es/Inicio/Cultura-ocio-y-deporte/El-dragon-Nabu/?vgnextfmt=default&vgnextoid=dc9c2ce8b3086910VgnVCM2000001f4a900aRCRD&vgnextchannel=7911f073808fe410VgnVCM2000000c205a0aRCRD
Teatro Familiar - Texturas,Sin descripción,de 1 a 6 años,No especificada,No especificada,domingo,a las 18 horas,Domingo 11 de mayo de 2025,Centro Cultural Galileo (Chamberí),"CALLE GALILEO, 39 MADRID",Gratuito,Recomendado para niñas y niños,https://www.madrid.es/portales/munimadrid/es/Inicio/Cultura-ocio-y-deporte/Programacion-Cultural-Chamberi/?vgnextfmt=default&vgnextoid=5ea6daba65bc4910VgnVCM1000001d4a900aRCRD&vgnextchannel=7911f073808fe410VgnVCM2000000c205a0aRCRD,https://www.madrid.es/UnidadesDescentralizadas/DistritoChamberi/Actividades/ficheros/cuadrado345.JPG,https://www.madrid.es/portales/munimadrid/es/Inicio/Cultura-ocio-y-deporte/Teatro-Familiar-Texturas/?vgnextfmt=default&vgnextoid=8e29fa9f39b76910VgnVCM2000001f4a900aRCRD&vgnextchannel=7911f073808fe410VgnVCM2000000c205a0aRCRD
"Espectáculo con magia, malabares y clown: ""Emi Mc-Clown, el payaso más mago y el mago más payaso""",¿Has conocido alguna vez al Payaso más Mago y al Mago más Payaso? ¡Pues Emi Mc-clown lo es!,desde 5 años,No especificada,No especificada,domingo,a las 12 horas,Domingo 11 de mayo de 2025,Centro Sociocultural Alfonso XII (Fuencarral - El Pardo),"CALLE MIRA EL RIO, 4 MADRID",Gratuito,Recomendado para niñas y niños,https://www.madrid.es/portales/munimadrid/es/Inicio/Cultura-ocio-y-deporte/Actividades-Centro-Sociocultural-Alfonso-XII-Fuencarral-El-Pardo-Mayo-2025/?vgnextfmt=default&vgnextoid=4f88d17704a1c810VgnVCM1000001d4a900aRCRD&vgnextchannel=7911f073808fe410VgnVCM2000000c205a0aRCRD,No disponible,https://www.madrid.es/portales/munimadrid/es/Inicio/Cultura-ocio-y-deporte/Espectaculo-con-magia-malabares-y-clown-Emi-Mc-Clown-el-payaso-mas-mago-y-el-mago-mas-payaso-/?vgnextfmt=default&vgnextoid=ec7e3af1ecc66910VgnVCM2000001f4a900aRCRD&vgnextchannel=7911f073808fe410VgnVCM2000000c205a0aRCRD
Talleres Infantiles,Para menores de 6 a 8 años. Máximo 20 plazas.,de 6 a 8 años,No especificada,No especificada,domingo,De 11 a 12 h,Del domingo 11 de mayo de 2025 al domingo 18 de mayo de 2025,Centro de Interpretación de la Naturaleza Montecarmelo (Fuencarral - El Pardo),"Carretera M-607 Km 13 L-10, null MADRID",Gratuito,Recomendado para niñas y niños,https://www.madrid.es/portales/munimadrid/es/Inicio/Cultura-ocio-y-deporte/Actividades-Centro-de-Interpretacion-de-la-Naturaleza-de-Montecarmelo-Mayo-2025/?vgnextfmt=default&vgnextoid=8265f1527cd5a810VgnVCM2000001f4a900aRCRD&vgnextchannel=7911f073808fe410VgnVCM2000000c205a0aRCRD,No disponible,https://www.madrid.es/portales/munimadrid/es/Inicio/Cultura-ocio-y-deporte/Talleres-Infantiles/?vgnextfmt=default&vgnextoid=7ad352544dd2f810VgnVCM1000001d4a900aRCRD&vgnextchannel=7911f073808fe410VgnVCM2000000c205a0aRCRD
La troupe del circo,Calle abierta infantil.,No especificada,No especificada,No especificada,domingo,a las 12:30 horas,Domingo 11 de mayo de 2025,Sin lugar,Sin dirección,Gratuito,Recomendado para niñas y niños,https://www.madrid.es/portales/munimadrid/es/Inicio/Cultura-ocio-y-deporte/Calle-abierta-infantil/?vgnextfmt=default&vgnextoid=6ef0157f943cf810VgnVCM2000001f4a900aRCRD&vgnextchannel=7911f073808fe410VgnVCM2000000c205a0aRCRD,https://www.madrid.es/UnidadWeb/UGBBDD/Actividades/Distritos/PuenteVallecas/Actividades/ficheros/1905Caperucita.jpg,https://www.madrid.es/portales/munimadrid/es/Inicio/Cultura-ocio-y-deporte/La-troupe-del-circo/?vgnextfmt=default&vgnextoid=b09d02ca7c186910VgnVCM1000001d4a900aRCRD&vgnextchannel=7911f073808fe410VgnVCM2000000c205a0aRCRD
Mestre Fufo,"Un mozo de cuerda, de los que ayudaban a los viajeros con el equipaje en el pasado siglo, va a entregar un baúl dirigido a un tal Mestre Fufo (afamado payaso de la época). Pero éste no está... En su lugar aparece un misterioso pianista que abrirá la puerta a la incertidumbre, al cruce de caminos, a la oportunidad de convertirlo todo en otra cosa.",a partir de 3 años,No especificada,No especificada,domingo,a las 12:30 horas,Domingo 11 de mayo de 2025,Centro Cultural Fernando Lázaro Carreter (Carabanchel),"CALLE VERDAD, 29 MADRID",Gratuito,Recomendado para niñas y niños,https://www.madrid.es/portales/munimadrid/es/Inicio/Cultura-ocio-y-deporte/Actividades-en-el-Centro-Cultural-Fernando-Lazaro-Carreter/?vgnextfmt=default&vgnextoid=25bff36edd371910VgnVCM2000001f4a900aRCRD&vgnextchannel=7911f073808fe410VgnVCM2000000c205a0aRCRD,https://www.madrid.es/UnidadWeb/UGBBDD/Actividades/Distritos/Carabanchel/ficheros/Mestrefufo.jpg,https://www.madrid.es/portales/munimadrid/es/Inicio/Cultura-ocio-y-deporte/Mestre-Fufo/?vgnextfmt=default&vgnextoid=ced9d865b7c66910VgnVCM2000001f4a900aRCRD&vgnextchannel=7911f073808fe410VgnVCM2000000c205a0aRCRD
Juego de pistas 'Los animales del bosque',"Dinámicas participativas para grupos familiares, que incluyen recorridos por el Parque y talleres creativos.",de 4 a 7 años,Más información en el apartado inscripción.. Se requiere reserva previa. Más información en el apartado inscripción.,No especificada,domingo,a las 11 horas,Domingo 11 de mayo de 2025,Aula ambiental La Cabaña del Retiro,"PASEO FERNAN NUÑEZ, 10 28009 MADRID",Gratuito,Recomendado para niñas y niños,No disponible,https://www.madrid.es/UnidadesDescentralizadas/DistritoRetiro/FICHEROS/ardilla.png,https://www.madrid.es/portales/munimadrid/es/Inicio/Cultura-ocio-y-deporte/Juego-de-pistas-Los-animales-del-bosque-/?vgnextfmt=default&vgnextoid=ef9951d1bf586910VgnVCM2000001f4a900aRCRD&vgnextchannel=7911f073808fe410VgnVCM2000000c205a0aRCRD
El dragón Nabú,Animathor.,a partir de 3 años,No especificada,No especificada,domingo,a las 18 horas,Domingo 11 de mayo de 2025,Centro Cultural Carril del Conde (Hortaleza),"CALLE CARRIL DEL CONDE, 57 MADRID",Gratuito,Recomendado para niñas y niños,https://www.madrid.es/portales/munimadrid/es/Inicio/Cultura-ocio-y-deporte/Actividades-en-el-Centro-Cultural-Carril-del-Conde/?vgnextfmt=default&vgnextoid=4dc76ed8d8a75610VgnVCM2000001f4a900aRCRD&vgnextchannel=7911f073808fe410VgnVCM2000000c205a0aRCRD,https://www.madrid.es/UnidadWeb/UGBBDD/Actividades/Distritos/Hortaleza/Actividades%20CC/Eventos/ficheros/nabu.jpg,https://www.madrid.es/portales/munimadrid/es/Inicio/Cultura-ocio-y-deporte/El-dragon-Nabu/?vgnextfmt=default&vgnextoid=3de1234abc586910VgnVCM1000001d4a900aRCRD&vgnextchannel=7911f073808fe410VgnVCM2000000c205a0aRCRD
Desmontando la zarzuela,Diverlírica.,a partir de 3 años,No especificada,No especificada,domingo,a las 12 horas,Domingo 11 de mayo de 2025,Centro Cultural Hortaleza,"CALLE SANTA VIRGILIA, 15 MADRID",Gratuito,Recomendado para niñas y niños,https://www.madrid.es/portales/munimadrid/es/Inicio/Cultura-ocio-y-deporte/Actividades-en-el-Centro-Cultural-Hortaleza/?vgnextfmt=default&vgnextoid=11a2acd787eb1610VgnVCM2000001f4a900aRCRD&vgnextchannel=7911f073808fe410VgnVCM2000000c205a0aRCRD,No disponible,https://www.madrid.es/portales/munimadrid/es/Inicio/Cultura-ocio-y-deporte/Desmontando-la-zarzuela/?vgnextfmt=default&vgnextoid=c2a094b983686910VgnVCM1000001d4a900aRCRD&vgnextchannel=7911f073808fe410VgnVCM2000000c205a0aRCRD
Las aventuras de las niñas perdidas,Compañía iberoamericana de teatro en movimiento.,No especificada,No especificada,No especificada,domingo,a las 12 horas,Domingo 11 de mayo de 2025,Parque Forestal de Valdebebas-Felipe VI,"AVENIDA LAS FUERZAS ARMADAS, 11 MADRID",Gratuito,Recomendado para niñas y niños,https://www.madrid.es/portales/munimadrid/es/Inicio/Cultura-ocio-y-deporte/Actividades-infantiles-en-los-parques-del-distrito/?vgnextfmt=default&vgnextoid=c1d315a9e0665910VgnVCM2000001f4a900aRCRD&vgnextchannel=7911f073808fe410VgnVCM2000000c205a0aRCRD,No disponible,https://www.madrid.es/portales/munimadrid/es/Inicio/Cultura-ocio-y-deporte/Las-aventuras-de-las-ninas-perdidas/?vgnextfmt=default&vgnextoid=58d66a6496686910VgnVCM1000001d4a900aRCRD&vgnextchannel=7911f073808fe410VgnVCM2000000c205a0aRCRD
Rutas guiadas por el Parque Forestal de Valdebebas. Mayo 2025,,No especificada,No especificada,No especificada,domingo,No especificado,Domingo 11 de mayo de 2025,Parque Forestal de Valdebebas-Felipe VI,"AVENIDA LAS FUERZAS ARMADAS, 11 MADRID",Gratuito,Recomendado para niñas y niños,https://www.madrid.es/portales/munimadrid/es/Inicio/Cultura-ocio-y-deporte/Rutas-guiadas-por-el-Parque-Forestal-de-Valdebebas-Mayo-2025/?vgnextfmt=default&vgnextoid=122a20b3d6ae1910VgnVCM2000001f4a900aRCRD&vgnextchannel=7911f073808fe410VgnVCM2000000c205a0aRCRD,No disponible,https://www.madrid.es/portales/munimadrid/es/Inicio/Cultura-ocio-y-deporte/Rutas-guiadas-por-el-Parque-Forestal-de-Valdebebas-Mayo-2025/?vgnextfmt=default&vgnextoid=1da91364a9686910VgnVCM1000001d4a900aRCRD&vgnextchannel=7911f073808fe410VgnVCM2000000c205a0aRCRD
Five little goats,Vamos a leer en inglés y a divertirnos en la biblioteca.,a partir de 4 años,No especificada,No especificada,lunes,a las 18 horas,Lunes 12 de mayo de 2025,Biblioteca Pública Municipal Mario Vargas Llosa (Centro),"CALLE BARCELO, 4 MADRID",Gratuito,Recomendado para niñas y niños,https://www.madrid.es/portales/munimadrid/es/Inicio/Cultura-ocio-y-deporte/Cuentacuentos-en-ingles/?vgnextfmt=default&vgnextoid=dd4e284aeea67810VgnVCM2000001f4a900aRCRD&vgnextchannel=7911f073808fe410VgnVCM2000000c205a0aRCRD,https://www.madrid.es/UnidadesDescentralizadas/Bibliotecas/BibliotecasPublicas/Actividades/Actividades_Infantiles_Juveniles/Cuentos/0_Cuentacuentos/ficheros/Ni%C3%B1oRiendo_260.jpg,https://www.madrid.es/portales/munimadrid/es/Inicio/Cultura-ocio-y-deporte/Five-little-goats/?vgnextfmt=default&vgnextoid=5ad0aa4735436910VgnVCM1000001d4a900aRCRD&vgnextchannel=7911f073808fe410VgnVCM2000000c205a0aRCRD
Llega San Isidro con cuentos y manualidades,"El día 15 de mayo es San Isidro, la festividad de Madrid, y para celebrarlo nos vamos a reunir en la biblioteca para hacer un abanico muy chulo y escuchar algún cuento. Te esperamos.",de 5 a 8 años,El proceso de inscripción finaliza el 13/05/2025. Para participar es necesario realizar inscripción previa en este enlace.. Para participar es necesario realizar inscripción previa en este enlace.,No especificada,martes,a las 18 horas,Martes 13 de mayo de 2025,Biblioteca Pública Municipal Canillejas (San Blas-Canillejas),"CALLE BOLTAÑA, 23 (EN CENTRO CULTURAL BUERO VALLEJO) 28022 MADRID",Gratuito,Recomendado para niñas y niños,No disponible,https://www.madrid.es/UnidadesDescentralizadas/Bibliotecas/BibliotecasPublicas/Actividades/Actividades_Infantiles_Juveniles/Talleres/ficheros/LlegaSIsidro_260.png,https://www.madrid.es/portales/munimadrid/es/Inicio/Cultura-ocio-y-deporte/Llega-San-Isidro-con-cuentos-y-manualidades/?vgnextfmt=default&vgnextoid=a11dced21c666910VgnVCM2000001f4a900aRCRD&vgnextchannel=7911f073808fe410VgnVCM2000000c205a0aRCRD
'Animalitis',"Duendes, tesoros, aventuras, misterios... Las bibliotecas están llenas de historias que cuenteros y cuenteras nos acercan a través de su creatividad y su magia.",a partir de 4 años,No especificada,No especificada,martes,a las 17:30 horas,Martes 13 de mayo de 2025,Biblioteca Pública Municipal María Zambrano (Tetuán),"PLAZA DONOSO, 5 MADRID",Gratuito,Recomendado para niñas y niños,https://www.madrid.es/portales/munimadrid/es/Inicio/Cultura-ocio-y-deporte/Cuentacuentos-del-12-al-18-de-mayo/?vgnextfmt=default&vgnextoid=c04ca32d985f5910VgnVCM1000001d4a900aRCRD&vgnextchannel=7911f073808fe410VgnVCM2000000c205a0aRCRD,https://www.madrid.es/UnidadesDescentralizadas/Bibliotecas/BibliotecasPublicas/ActividadesBPM/2017/CuentosInfantiles/Cuentos_infantiles/Eventos/ficheros/RobertoMezquita_260x260.jpg,https://www.madrid.es/portales/munimadrid/es/Inicio/Cultura-ocio-y-deporte/-Animalitis-/?vgnextfmt=default&vgnextoid=b15644afff756910VgnVCM2000001f4a900aRCRD&vgnextchannel=7911f073808fe410VgnVCM2000000c205a0aRCRD
'A la mar salada',"Duendes, tesoros, aventuras, misterios... Las bibliotecas están llenas de historias que cuenteros y cuenteras nos acercan a través de su creatividad y su magia.",a partir de 2 años,No especificada,No especificada,martes,a las 18 horas,Martes 13 de mayo de 2025,Biblioteca Pública Municipal Huerta de la Salud (Hortaleza),"CALLE MAR DE LAS ANTILLAS, 10 MADRID",Gratuito,Recomendado para niñas y niños,https://www.madrid.es/portales/munimadrid/es/Inicio/Cultura-ocio-y-deporte/Cuentacuentos-del-12-al-18-de-mayo/?vgnextfmt=default&vgnextoid=c04ca32d985f5910VgnVCM1000001d4a900aRCRD&vgnextchannel=7911f073808fe410VgnVCM2000000c205a0aRCRD,https://www.madrid.es/UnidadesDescentralizadas/Bibliotecas/BibliotecasPublicas/ActividadesBPM/Actividades%20Infantiles%20Juveniles/Cuentos/ficheros/ImagenesGenerales/GatosPerros_260x260.jpg,https://www.madrid.es/portales/munimadrid/es/Inicio/Cultura-ocio-y-deporte/-A-la-mar-salada-/?vgnextfmt=default&vgnextoid=2c307647da5f5910VgnVCM1000001d4a900aRCRD&vgnextchannel=7911f073808fe410VgnVCM2000000c205a0aRCRD
Cine infantil en la Biblioteca María Lejárraga: 'Antz',Ven a la biblioteca a disfrutar del cine.,No especificada,No especificada,No especificada,martes,a las 18 horas,Martes 13 de mayo de 2025,Biblioteca Pública Municipal María Lejárraga (Hortaleza),"CALLE PRINCESA DE EBOLI, 29 MADRID",Gratuito,Recomendado para niñas y niños,https://www.madrid.es/portales/munimadrid/es/Inicio/Cultura-ocio-y-deporte/Cine-infantil-en-la-Biblioteca-Maria-Lejarraga/?vgnextfmt=default&vgnextoid=cba4ec15205d3910VgnVCM2000001f4a900aRCRD&vgnextchannel=7911f073808fe410VgnVCM2000000c205a0aRCRD,https://www.madrid.es/UnidadesDescentralizadas/Bibliotecas/BibliotecasPublicas/Actividades/Actividades_Infantiles_Juveniles/Cine/ficheros/CineLejarraga_260.jpg,https://www.madrid.es/portales/munimadrid/es/Inicio/Cultura-ocio-y-deporte/Cine-infantil-en-la-Biblioteca-Maria-Lejarraga-Antz-/?vgnextfmt=default&vgnextoid=897e969485f75910VgnVCM2000001f4a900aRCRD&vgnextchannel=7911f073808fe410VgnVCM2000000c205a0aRCRD
"'1. 2, 3, dedos, manos y pies'","Nunca es demasiado pronto para iniciar a los bebés en el maravilloso mundo del libro y la lectura. Además de estimular su imaginación, descubrirán colores, sonidos y palabras que enriquecerán su vocabulario.",No especificada,Para asistir es necesaria la inscripción a través de este enlace.,No especificada,martes,a las 17:30 horas,Martes 13 de mayo de 2025,Biblioteca Pública Municipal Francisco Ibáñez (Chamartín),"CALLE MANTUANO, 51 MADRID",Gratuito,Recomendado para niñas y niños,https://www.madrid.es/portales/munimadrid/es/Inicio/Cultura-ocio-y-deporte/Bebecuentos/?vgnextfmt=default&vgnextoid=29805b097f75e710VgnVCM1000001d4a900aRCRD&vgnextchannel=7911f073808fe410VgnVCM2000000c205a0aRCRD,https://www.madrid.es/UnidadesDescentralizadas/Bibliotecas/BibliotecasPublicas/ActividadesBPM/Leyendo_Cuentos/ficheros/LeyendoBebes.png,https://www.madrid.es/portales/munimadrid/es/Inicio/Cultura-ocio-y-deporte/-1-2-3-dedos-manos-y-pies-/?vgnextfmt=default&vgnextoid=ea14528353436910VgnVCM2000001f4a900aRCRD&vgnextchannel=7911f073808fe410VgnVCM2000000c205a0aRCRD
Visita externa,Para adultos. Máximo 20 plazas.,No especificada,No especificada,No especificada,martes,a las 11 horas,Martes 13 de mayo de 2025,Centro de Interpretación de la Naturaleza Montecarmelo (Fuencarral - El Pardo),"Carretera M-607 Km 13 L-10, null MADRID",Gratuito,Recomendado para niñas y niños,https://www.madrid.es/portales/munimadrid/es/Inicio/Cultura-ocio-y-deporte/Actividades-Centro-de-Interpretacion-de-la-Naturaleza-de-Montecarmelo-Mayo-2025/?vgnextfmt=default&vgnextoid=8265f1527cd5a810VgnVCM2000001f4a900aRCRD&vgnextchannel=7911f073808fe410VgnVCM2000000c205a0aRCRD,No disponible,https://www.madrid.es/portales/munimadrid/es/Inicio/Cultura-ocio-y-deporte/Visita-externa/?vgnextfmt=default&vgnextoid=1707a3f71f766910VgnVCM2000001f4a900aRCRD&vgnextchannel=7911f073808fe410VgnVCM2000000c205a0aRCRD
Do It Yourself: Especial San Isidro,Participa en nuestro taller Do It Yourself donde haremos manualidades con materiales reciclados que te facilitaremos en la biblioteca.,de 5 a 10 años,El proceso de inscripción ha finalizado. Aforo: 15 plazas por orden de inscripción.. Aforo: 15 plazas por orden de inscripción.,No especificada,miércoles,a las 18 horas,Miércoles 14 de mayo de 2025,Biblioteca Pública Municipal José Hierro (San Blas-Canillejas),"CALLE MARIA SEVILLA DIAGO, 15 28022 MADRID",Gratuito,Recomendado para niñas y niños,No disponible,https://www.madrid.es/UnidadesDescentralizadas/Bibliotecas/BibliotecasPublicas/ActividadesBPM/Actividades%20Infantiles%20Juveniles/Talleres/Talleres%20Infantiles/ficheros/DoItYourself_260x260.jfif,https://www.madrid.es/portales/munimadrid/es/Inicio/Cultura-ocio-y-deporte/Do-It-Yourself-Especial-San-Isidro/?vgnextfmt=default&vgnextoid=d5dcd15c0bfe4910VgnVCM2000001f4a900aRCRD&vgnextchannel=7911f073808fe410VgnVCM2000000c205a0aRCRD
'Cuentos en la granja',"Duendes, tesoros, aventuras, misterios... Las bibliotecas están llenas de historias que cuenteros y cuenteras nos acercan a través de su creatividad y su magia.",a partir de 4 años,Para asistir es necesario realizar inscripción previa a través de este enlace.,No especificada,miércoles,a las 18 horas,Miércoles 14 de mayo de 2025,Biblioteca Pública Municipal Aluche (Latina),"CALLE CAMARENA, 10 MADRID",Gratuito,Recomendado para niñas y niños,https://www.madrid.es/portales/munimadrid/es/Inicio/Cultura-ocio-y-deporte/Cuentacuentos-del-12-al-18-de-mayo/?vgnextfmt=default&vgnextoid=c04ca32d985f5910VgnVCM1000001d4a900aRCRD&vgnextchannel=7911f073808fe410VgnVCM2000000c205a0aRCRD,https://www.madrid.es/UnidadesDescentralizadas/Bibliotecas/BibliotecasPublicas/ActividadesBPM/Actividades_Infantiles_Juveniles/Cuentos/0_Cuentacuentos/Ficheros_FotosCuentacuentos/Cuentacuentos-libroabierto-perro-ni%C3%B1aparaguas_260.png,https://www.madrid.es/portales/munimadrid/es/Inicio/Cultura-ocio-y-deporte/-Cuentos-en-la-granja-/?vgnextfmt=default&vgnextoid=952744afff756910VgnVCM2000001f4a900aRCRD&vgnextchannel=7911f073808fe410VgnVCM2000000c205a0aRCRD
The cook and the king,Vamos a leer en inglés y a divertirnos en la biblioteca.,a partir de 5 años,Para asistir es necesaria la inscripción a través de este enlace.,No especificada,miércoles,a las 18 horas,Miércoles 14 de mayo de 2025,Biblioteca Pública Municipal Francisco Ayala (Vicálvaro),"BULEVAR INDALECIO PRIETO, 21 MADRID",Gratuito,Recomendado para niñas y niños,https://www.madrid.es/portales/munimadrid/es/Inicio/Cultura-ocio-y-deporte/Cuentacuentos-en-ingles/?vgnextfmt=default&vgnextoid=dd4e284aeea67810VgnVCM2000001f4a900aRCRD&vgnextchannel=7911f073808fe410VgnVCM2000000c205a0aRCRD,https://www.madrid.es/UnidadesDescentralizadas/Bibliotecas/BibliotecasPublicas/ActividadesBPM/Actividades_Infantiles_Juveniles/Cuentos/0_Cuentacuentos/Ficheros_FotosCuentacuentos/Cuentacuentos-ni%C3%B1o-bocaabierta-leyendo_260.png,https://www.madrid.es/portales/munimadrid/es/Inicio/Cultura-ocio-y-deporte/The-cook-and-the-king/?vgnextfmt=default&vgnextoid=8e02aa4735436910VgnVCM1000001d4a900aRCRD&vgnextchannel=7911f073808fe410VgnVCM2000000c205a0aRCRD
